<?xml version="1.0" encoding="utf-8"?>
<!DOCTYPE entity SYSTEM
    "https://github.com/nibralab/joomla-architecture/blob/master/code/Joomla/ORM/Definition/entity.dtd">
<entity name="Joomla\PageBuilder\Entity\Layout">

    <storage>
        <default table="layouts"/>
    </storage>

    <fields>
        <field name="id"
               type="id"
               label="JGLOBAL_FIELD_ID_LABEL"
               description="JGLOBAL_FIELD_ID_DESC"
               default="null"
        >
            <validation rule="positive"/>
            <validation rule="integer"/>
        </field>

        <field name="title"
               type="title"
               label="JGLOBAL_TITLE"
        >
            <validation rule="maxlen" value="64"/>
        </field>

    </fields>

    <relations>
        <belongsTo name="parent_id"
                   entity="Layout"
                   label="JFIELD_PARENT_LABEL"
                   description="JFIELD_PARENT_DESC"
        />
        <belongsTo name="template_id"
                   entity="Template"
        />
        <hasMany name="children" entity="Layout" reference="parent_id"/>
        <hasMany name="pages" entity="Page" reference="layout_id"/>
        <hasMany name="content" entity="Content" reference="layout_id"/>
    </relations>

</entity>
